,Gene_set,Term,Overlap,P-value,Adjusted P-value,Old P-value,Old Adjusted P-value,Odds Ratio,Combined Score,Genes
450,GO_Biological_Process_2017b,positive regulation of chondrocyte proliferation (GO:1902732),1/330,0.2588893360476438,0.320930044740072,0,0,3.513856606472376,4.748466227535915,NRG1
451,GO_Biological_Process_2017b,positive regulation of cell proliferation involved in kidney development (GO:1901724),1/330,0.2588893360476438,0.320930044740072,0,0,3.513856606472376,4.748466227535915,NRG1
459,GO_Biological_Process_2017b,positive regulation of osteoblast proliferation (GO:0033690),1/335,0.2622744229860118,0.320930044740072,0,0,3.4603733709052484,4.63123882575208,NRG1
458,GO_Biological_Process_2017b,positive regulation of trophectodermal cell proliferation (GO:1904075),1/335,0.2622744229860118,0.320930044740072,0,0,3.4603733709052484,4.63123882575208,NRG1
457,GO_Biological_Process_2017b,positive regulation of neural precursor cell proliferation (GO:2000179),1/335,0.2622744229860118,0.320930044740072,0,0,3.4603733709052484,4.63123882575208,NRG1
449,GO_Biological_Process_2017b,positive regulation of cell proliferation involved in heart morphogenesis (GO:2000138),1/329,0.2582105606693922,0.320930044740072,0,0,3.524748923959828,4.772439196593552,NRG1
455,GO_Biological_Process_2017b,positive regulation of cardiac muscle cell proliferation (GO:0060045),1/334,0.2615985760079172,0.320930044740072,0,0,3.470941529765059,4.6543385755323365,NRG1
456,GO_Biological_Process_2017b,positive regulation of stem cell proliferation (GO:2000648),1/334,0.2615985760079172,0.320930044740072,0,0,3.470941529765059,4.6543385755323365,NRG1
453,GO_Biological_Process_2017b,positive regulation of glial cell proliferation (GO:0060252),1/330,0.2588893360476438,0.320930044740072,0,0,3.513856606472376,4.748466227535915,NRG1
452,GO_Biological_Process_2017b,positive regulation of myoblast proliferation (GO:2000288),1/330,0.2588893360476438,0.320930044740072,0,0,3.513856606472376,4.748466227535915,NRG1
454,GO_Biological_Process_2017b,central nervous system development (GO:0007417),1/333,0.2609221442988567,0.320930044740072,0,0,3.4815733522324592,4.677609435230168,NRG1
460,GO_Biological_Process_2017b,positive regulation of growth plate cartilage chondrocyte proliferation (GO:0061913),1/337,0.2636243646110588,0.3215545593822788,0,0,3.4394257703081235,4.585545793046719,NRG1
461,GO_Biological_Process_2017b,protein ubiquitination involved in ubiquitin-dependent protein catabolic process (GO:0042787),1/344,0.2683308111180761,0.3260358244760215,0,0,3.368032927456697,4.430764152578589,RNF220
462,GO_Biological_Process_2017b,positive regulation of fibroblast proliferation (GO:0048146),1/345,0.2690008369044981,0.3260358244760215,0,0,3.3580711354309165,4.409284370551608,NRG1
464,GO_Biological_Process_2017b,positive regulation of epithelial cell proliferation (GO:0050679),1/348,0.2710074389331693,0.3264020412308297,0,0,3.3285302593659942,4.345759091830501,NRG1
463,GO_Biological_Process_2017b,positive regulation of smooth muscle cell proliferation (GO:0048661),1/347,0.2703391503064064,0.3264020412308297,0,0,3.338320299217953,4.366783326963017,NRG1
113,GO_Biological_Process_2018,phosphorylation (GO:0016310),1/386,0.2959783035302231,0.3375191180607808,0,0,2.994194041252865,3.6453388031640617,LIMD1
115,GO_Biological_Process_2018,protein modification by small protein conjugation (GO:0032446),1/398,0.3036945000802164,0.3403472845726563,0,0,2.901911394280634,3.458303620413356,RNF220
114,GO_Biological_Process_2018,transmembrane receptor protein tyrosine kinase signaling pathway (GO:0007169),1/396,0.3024140385644269,0.3403472845726563,0,0,2.916902457185406,3.4884934470701143,NRG1
465,GO_Biological_Process_2017b,protein polyubiquitination (GO:0000209),1/381,0.2927394469617987,0.3514708720575827,0,0,3.0343653250773994,3.727633826121644,RNF220
466,GO_Biological_Process_2017b,dephosphorylation of RNA polymerase II C-terminal domain (GO:0070940),1/387,0.2966243916293408,0.3550223187313673,0,0,2.9862846693081377,3.62919776036838,PTPRB
116,GO_Biological_Process_2018,positive regulation of cell proliferation (GO:0008284),1/424,0.3201397912985814,0.3557108792206461,0,0,2.7199276873870115,3.097990919808182,NRG1
467,GO_Biological_Process_2017b,protein phosphorylation (GO:0006468),1/401,0.3056110309726504,0.3646387067368383,0,0,2.8797058823529413,3.4137246640835075,LIMD1
468,GO_Biological_Process_2017b,negative regulation of canonical Wnt signaling pathway involved in controlling type B pancreatic cell proliferation (GO:2000080),1/413,0.3132274480371527,0.3725655670752469,0,0,2.794117647058824,3.243483521263582,LIMD1
117,GO_Biological_Process_2018,nervous system development (GO:0007399),1/455,0.3392682331069789,0.3737700873212479,0,0,2.5301891681782847,2.735044002052133,NRG1
118,GO_Biological_Process_2018,neutrophil degranulation (GO:0043312),1/479,0.3537270465373631,0.3819867511122509,0,0,2.400196898843219,2.494355946913392,PTPRB
119,GO_Biological_Process_2018,positive regulation of intracellular signal transduction (GO:1902533),1/479,0.3537270465373631,0.3819867511122509,0,0,2.400196898843219,2.494355946913392,NRG1
120,GO_Biological_Process_2018,neutrophil activation involved in immune response (GO:0002283),1/483,0.3561076019979903,0.3819867511122509,0,0,2.379790090309983,2.4571864351258017,PTPRB
121,GO_Biological_Process_2018,neutrophil mediated immunity (GO:0002446),1/487,0.3584798741207277,0.3819867511122509,0,0,2.3597191963205035,2.420795241124082,PTPRB
122,GO_Biological_Process_2018,protein ubiquitination (GO:0016567),1/506,0.3696358781774415,0.3906720663664015,0,0,2.2687245195107746,2.257918291811353,RNF220
469,GO_Biological_Process_2017b,positive regulation of cell proliferation (GO:0008284),1/442,0.3313093560685172,0.3928528897035358,0,0,2.6065092703748167,2.879417905717563,NRG1
123,GO_Biological_Process_2018,positive regulation of cellular process (GO:0048522),1/519,0.3771630883220924,0.3954129151763872,0,0,2.210311151487622,2.155224870869906,NRG1
124,GO_Biological_Process_2018,negative regulation of transcription from RNA polymerase II promoter (GO:0000122),1/565,0.4031218621353314,0.4192467366207447,0,0,2.025239883187317,1.8399635978121285,NFIB
471,GO_Biological_Process_2017b,negative regulation of pri-miRNA transcription from RNA polymerase II promoter (GO:1902894),1/488,0.3590716510430721,0.4231521303061434,0,0,2.3547529894914843,2.411816484757892,NFIB
470,GO_Biological_Process_2017b,neutrophil degranulation (GO:0043312),1/487,0.3584798741207277,0.4231521303061434,0,0,2.3597191963205035,2.420795241124082,PTPRB
505,GO_Biological_Process_2017b,transcriptional activation by promoter-enhancer looping (GO:0071733),1/721,0.4837532099670621,0.4959841894510899,0,0,1.5736928104575163,1.142784873110582,NFIB
506,GO_Biological_Process_2017b,positive regulation of terminal gap gene transcription (GO:0007363),1/721,0.4837532099670621,0.4959841894510899,0,0,1.5736928104575163,1.142784873110582,NFIB
507,GO_Biological_Process_2017b,positive regulation of transcription from RNA polymerase II promoter during mitotic cell cycle (GO:0046022),1/721,0.4837532099670621,0.4959841894510899,0,0,1.5736928104575163,1.142784873110582,NFIB
504,GO_Biological_Process_2017b,positive regulation of phospholipid biosynthetic process by positive regulation of transcription from RNA polymerase II promoter (GO:1900413),1/721,0.4837532099670621,0.4959841894510899,0,0,1.5736928104575163,1.142784873110582,NFIB
508,GO_Biological_Process_2017b,positive regulation of inositol biosynthetic process by positive regulation of transcription from RNA polymerase II promoter (GO:1900375),1/721,0.4837532099670621,0.4959841894510899,0,0,1.5736928104575163,1.142784873110582,NFIB
502,GO_Biological_Process_2017b,positive regulation of transcription via serum response element binding (GO:0010735),1/721,0.4837532099670621,0.4959841894510899,0,0,1.5736928104575163,1.142784873110582,NFIB
509,GO_Biological_Process_2017b,positive regulation of transcription from RNA polymerase II promoter in response to stress (GO:0036003),1/722,0.4842352070875041,0.4959841894510899,0,0,1.5714285714285714,1.139575682538001,NFIB
501,GO_Biological_Process_2017b,positive regulation of transcription from RNA polymerase II promoter involved in smooth muscle cell differentiation (GO:2000721),1/721,0.4837532099670621,0.4959841894510899,0,0,1.5736928104575163,1.142784873110582,NFIB
500,GO_Biological_Process_2017b,positive regulation of posterior gap gene transcription (GO:0007360),1/721,0.4837532099670621,0.4959841894510899,0,0,1.5736928104575163,1.142784873110582,NFIB
499,GO_Biological_Process_2017b,positive regulation of starch catabolic process by positive regulation of transcription from RNA polymerase II promoter (GO:0035957),1/720,0.4832707874982981,0.4959841894510899,0,0,1.575963347786959,1.1460061050690529,NFIB
498,GO_Biological_Process_2017b,positive regulation of snRNA transcription from RNA polymerase II promoter (GO:1905382),1/720,0.4832707874982981,0.4959841894510899,0,0,1.575963347786959,1.1460061050690529,NFIB
503,GO_Biological_Process_2017b,positive regulation of transcription involved in G2/M transition of mitotic cell cycle (GO:0090282),1/721,0.4837532099670621,0.4959841894510899,0,0,1.5736928104575163,1.142784873110582,NFIB
510,GO_Biological_Process_2017b,positive regulation of gluconeogenesis by positive regulation of transcription from RNA polymerase II promoter (GO:0035948),1/723,0.4847167791599755,0.4959841894510899,0,0,1.5691706045299003,1.1363784746680536,NFIB
518,GO_Biological_Process_2017b,positive regulation of transcription initiation from RNA polymerase II promoter (GO:0060261),1/726,0.486158948639852,0.4959841894510899,0,0,1.5624340770791074,1.12685816405929,NFIB
512,GO_Biological_Process_2017b,SREBP signaling pathway (GO:0032933),1/725,0.4856786495626825,0.4959841894510899,0,0,1.564673383165421,1.130019773452194,NFIB
513,GO_Biological_Process_2017b,positive regulation of SREBP signaling pathway (GO:2000640),1/725,0.4856786495626825,0.4959841894510899,0,0,1.564673383165421,1.130019773452194,NFIB
514,GO_Biological_Process_2017b,positive regulation of transcription from RNA polymerase II promoter involved in norepinephrine biosynthetic process (GO:2000763),1/725,0.4856786495626825,0.4959841894510899,0,0,1.564673383165421,1.130019773452194,NFIB
515,GO_Biological_Process_2017b,positive regulation of pri-miRNA transcription from RNA polymerase II promoter (GO:1902895),1/725,0.4856786495626825,0.4959841894510899,0,0,1.564673383165421,1.130019773452194,NFIB
516,GO_Biological_Process_2017b,positive regulation of transcription from RNA polymerase II promoter in response to nitrogen starvation (GO:0036278),1/725,0.4856786495626825,0.4959841894510899,0,0,1.564673383165421,1.130019773452194,NFIB
517,GO_Biological_Process_2017b,positive regulation of central gap gene transcription (GO:0007357),1/725,0.4856786495626825,0.4959841894510899,0,0,1.564673383165421,1.130019773452194,NFIB
497,GO_Biological_Process_2017b,positive regulation of filamentous growth of a population of unicellular organisms in response to starvation by positive regulation of transcription from RNA polymerase II promoter (GO:1904741),1/720,0.4832707874982981,0.4959841894510899,0,0,1.575963347786959,1.1460061050690529,NFIB
519,GO_Biological_Process_2017b,positive regulation of transcription from RNA polymerase II promoter in response to acidic pH (GO:0061402),1/727,0.4866388240637988,0.4959841894510899,0,0,1.5602009398800842,1.1237083055889487,NFIB
520,GO_Biological_Process_2017b,regulation of potassium ion concentration by positive regulation of transcription from RNA polymerase II promoter (GO:0097301),1/728,0.4871182762124091,0.4959841894510899,0,0,1.557973946112145,1.1205701408849242,NFIB
521,GO_Biological_Process_2017b,regulation of reactive oxygen species metabolic process by positive regulation of transcription from RNA polymerase II promoter (GO:1904488),1/729,0.4875973054306829,0.4959841894510899,0,0,1.5557530704589528,1.11744361324453,NFIB
522,GO_Biological_Process_2017b,positive regulation of transcription from RNA polymerase II promoter involved in defense response to fungus (GO:1901244),1/730,0.4880759120548141,0.4959841894510899,0,0,1.5535382877430808,1.1143286663381513,NFIB
523,GO_Biological_Process_2017b,positive regulation of sodium ion transport by positive regulation of transcription from RNA polymerase II promoter (GO:0061423),1/731,0.4885540964858179,0.4959841894510899,0,0,1.5513295729250605,1.1112252439725694,NFIB
524,GO_Biological_Process_2017b,positive regulation of transcription elongation from RNA polymerase II promoter (GO:0032968),1/733,0.4895092000326683,0.4959841894510899,0,0,1.5469302475088396,1.1050527508707135,NFIB
511,GO_Biological_Process_2017b,positive regulation of transcription from RNA polymerase II promoter involved in cellular response to chemical stimulus (GO:1901522),1/724,0.4851979265596331,0.4959841894510899,0,0,1.566918883736067,1.133193190935309,NFIB
496,GO_Biological_Process_2017b,positive regulation of transcription from RNA polymerase II promoter involved in meiotic cell cycle (GO:0010673),1/720,0.4832707874982981,0.4959841894510899,0,0,1.575963347786959,1.1460061050690529,NFIB
489,GO_Biological_Process_2017b,regulation of cellular ketone metabolic process by positive regulation of transcription from RNA polymerase II promoter (GO:0072366),1/720,0.4832707874982981,0.4959841894510899,0,0,1.575963347786959,1.1460061050690529,NFIB
494,GO_Biological_Process_2017b,positive regulation of termination of RNA polymerase II transcription (GO:1904595),1/720,0.4832707874982981,0.4959841894510899,0,0,1.575963347786959,1.1460061050690529,NFIB
472,GO_Biological_Process_2017b,positive regulation of ribosomal protein gene transcription from RNA polymerase II promoter (GO:0060963),1/720,0.4832707874982981,0.4959841894510899,0,0,1.575963347786959,1.1460061050690529,NFIB
473,GO_Biological_Process_2017b,regulation of lipid transport by positive regulation of transcription from RNA polymerase II promoter (GO:0072369),1/720,0.4832707874982981,0.4959841894510899,0,0,1.575963347786959,1.1460061050690529,NFIB
474,GO_Biological_Process_2017b,positive regulation of pyrimidine-containing compound salvage by positive regulation of transcription from RNA polymerase II promoter (GO:1904001),1/720,0.4832707874982981,0.4959841894510899,0,0,1.575963347786959,1.1460061050690529,NFIB
475,GO_Biological_Process_2017b,positive regulation of ergosterol biosynthetic process by positive regulation of transcription from RNA polymerase II promoter (GO:0035961),1/720,0.4832707874982981,0.4959841894510899,0,0,1.575963347786959,1.1460061050690529,NFIB
476,GO_Biological_Process_2017b,positive regulation of transcription from RNA polymerase II promoter involved in heart development (GO:1901228),1/720,0.4832707874982981,0.4959841894510899,0,0,1.575963347786959,1.1460061050690529,NFIB
477,GO_Biological_Process_2017b,positive regulation of transcription from RNA polymerase II promoter by histone modification (GO:1903757),1/720,0.4832707874982981,0.4959841894510899,0,0,1.575963347786959,1.1460061050690529,NFIB
478,GO_Biological_Process_2017b,positive regulation of purine nucleotide biosynthetic process by positive regulation of transcription from RNA polymerase II promoter (GO:1900418),1/720,0.4832707874982981,0.4959841894510899,0,0,1.575963347786959,1.1460061050690529,NFIB
479,GO_Biological_Process_2017b,positive regulation of telomeric RNA transcription from RNA pol II promoter (GO:1901582),1/720,0.4832707874982981,0.4959841894510899,0,0,1.575963347786959,1.1460061050690529,NFIB
495,GO_Biological_Process_2017b,positive regulation of cellular alcohol catabolic process by positive regulation of transcription from RNA polymerase II promoter (GO:1900422),1/720,0.4832707874982981,0.4959841894510899,0,0,1.575963347786959,1.1460061050690529,NFIB
481,GO_Biological_Process_2017b,positive regulation of mating type switching by positive regulation of transcription from RNA polymerase II promoter (GO:1900423),1/720,0.4832707874982981,0.4959841894510899,0,0,1.575963347786959,1.1460061050690529,NFIB
482,GO_Biological_Process_2017b,regulation of glycolytic process by positive regulation of transcription from RNA polymerase II promoter (GO:0072363),1/720,0.4832707874982981,0.4959841894510899,0,0,1.575963347786959,1.1460061050690529,NFIB
480,GO_Biological_Process_2017b,positive regulation of oligopeptide transport by positive regulation of transcription from RNA polymerase II promoter (GO:0035951),1/720,0.4832707874982981,0.4959841894510899,0,0,1.575963347786959,1.1460061050690529,NFIB
484,GO_Biological_Process_2017b,positive regulation of invasive growth in response to glucose limitation by positive regulation of transcription from RNA polymerase II promoter (GO:0036095),1/720,0.4832707874982981,0.4959841894510899,0,0,1.575963347786959,1.1460061050690529,NFIB
493,GO_Biological_Process_2017b,positive regulation of transcription from RNA polymerase II promoter by calcium-mediated signaling (GO:1900622),1/720,0.4832707874982981,0.4959841894510899,0,0,1.575963347786959,1.1460061050690529,NFIB
483,GO_Biological_Process_2017b,positive regulation of flocculation via cell wall protein-carbohydrate interaction by positive regulation of transcription from RNA polymerase II promoter (GO:1900524),1/720,0.4832707874982981,0.4959841894510899,0,0,1.575963347786959,1.1460061050690529,NFIB
491,GO_Biological_Process_2017b,positive regulation of sulfate assimilation by positive regulation of transcription from RNA polymerase II promoter (GO:1900478),1/720,0.4832707874982981,0.4959841894510899,0,0,1.575963347786959,1.1460061050690529,NFIB
490,GO_Biological_Process_2017b,transcriptional activation by promoter-terminator looping (GO:0090203),1/720,0.4832707874982981,0.4959841894510899,0,0,1.575963347786959,1.1460061050690529,NFIB
492,GO_Biological_Process_2017b,positive regulation of ethanol catabolic process by positive regulation of transcription from RNA polymerase II promoter (GO:0061425),1/720,0.4832707874982981,0.4959841894510899,0,0,1.575963347786959,1.1460061050690529,NFIB
488,GO_Biological_Process_2017b,positive regulation of sulfite transport by positive regulation of transcription from RNA polymerase II promoter (GO:0061426),1/720,0.4832707874982981,0.4959841894510899,0,0,1.575963347786959,1.1460061050690529,NFIB
487,GO_Biological_Process_2017b,positive regulation of peroxisome organization by positive regulation of transcription from RNA polymerase II promoter (GO:0061424),1/720,0.4832707874982981,0.4959841894510899,0,0,1.575963347786959,1.1460061050690529,NFIB
486,GO_Biological_Process_2017b,positive regulation of transcription from RNA polymerase II promoter involved in stress response to cadmium ion (GO:1902901),1/720,0.4832707874982981,0.4959841894510899,0,0,1.575963347786959,1.1460061050690529,NFIB
485,GO_Biological_Process_2017b,positive regulation of pseudohyphal growth by positive regulation of transcription from RNA polymerase II promoter (GO:1900461),1/720,0.4832707874982981,0.4959841894510899,0,0,1.575963347786959,1.1460061050690529,NFIB
525,GO_Biological_Process_2017b,positive regulation of DNA repair by positive regulation of transcription from RNA polymerase II promoter (GO:1900404),1/739,0.4923644136300784,0.4975608718214249,0,0,1.5338753387533874,1.0868061402096492,NFIB
526,GO_Biological_Process_2017b,positive regulation of transcription of Notch receptor target (GO:0007221),1/744,0.4947322303753704,0.4986380111414917,0,0,1.5231573113767714,1.0719046114281638,NFIB
527,GO_Biological_Process_2017b,positive regulation of transcription from RNA polymerase II promoter involved in defense response to Gram-negative bacterium (GO:1902097),1/756,0.5003725037638211,0.5029991310801666,0,0,1.4980132450331125,1.0372280416115367,NFIB
528,GO_Biological_Process_2017b,positive regulation of transcription from RNA polymerase II promoter involved in neuron differentiation (GO:1904081),1/770,0.5068776612899408,0.5082045661624276,0,0,1.4696703128585635,0.9986198198302556,NFIB
125,GO_Biological_Process_2018,regulation of cell proliferation (GO:0042127),1/740,0.4928388137103572,0.5084844903360829,0,0,1.531720130542068,1.0838039737777705,NRG1
126,GO_Biological_Process_2018,positive regulation of transcription from RNA polymerase II promoter (GO:0045944),1/848,0.5416809069633209,0.5544765189388324,0,0,1.3289117299812487,0.8147267893870057,NFIB
127,GO_Biological_Process_2018,cellular protein modification process (GO:0006464),1/1001,0.6033210645171119,0.6127479561501917,0,0,1.1165882352941177,0.5642184876685615,PTPRB
128,GO_Biological_Process_2018,"positive regulation of transcription, DNA-templated (GO:0045893)",1/1120,0.6457582943028364,0.6507641725532459,0,0,0.9915891289491668,0.4336516763809753,NFIB
529,GO_Biological_Process_2017b,positive regulation of transcription from RNA polymerase II promoter (GO:0045944),1/1175,0.6638884845651349,0.6638884845651349,0,0,0.942378995891372,0.3860371576961133,NFIB
129,GO_Biological_Process_2018,regulation of transcription from RNA polymerase II promoter (GO:0006357),1/1478,0.7490551439879347,0.7490551439879347,0,0,0.7369867378230913,0.2129469192399496,NFIB
